{
  "$schema": "http://json-schema.org/draft-07/schema#",
  "title": "fanout agent-mode output envelope",
  "description": "Stable agent-mode JSON envelope produced by `fanout --json`. All RTLScanner subcommands share the same top-level shape.",
  "type": "object",
  "required": [
    "tool",
    "version",
    "status",
    "command",
    "data",
    "diagnostics",
    "errors",
    "summary"
  ],
  "properties": {
    "tool": {
      "type": "string",
      "const": "fanout"
    },
    "version": {
      "type": "string"
    },
    "status": {
      "type": "string",
      "enum": [
        "ok",
        "error"
      ]
    },
    "command": {
      "type": "object",
      "description": "Echo of the parsed argparse Namespace minus output flags."
    },
    "data": {
      "oneOf": [
        {
          "type": "object",
          "required": [
            "mode",
            "scope",
            "signal",
            "start",
            "nodes",
            "edges",
            "max_depth"
          ],
          "properties": {
            "mode": {
              "type": "string",
              "const": "fanout"
            },
            "scope": {
              "type": "string"
            },
            "signal": {
              "type": "string",
              "description": "Starting signal name."
            },
            "start": {
              "type": "string",
              "description": "Elaborated hierarchical path of the starting signal."
            },
            "nodes": {
              "type": "array",
              "items": {
                "type": "string"
              }
            },
            "edges": {
              "type": "array",
              "items": {
                "type": "object",
                "required": [
                  "source",
                  "target",
                  "kind",
                  "description"
                ],
                "properties": {
                  "source": {
                    "type": "string"
                  },
                  "target": {
                    "type": "string"
                  },
                  "kind": {
                    "type": "string"
                  },
                  "description": {
                    "type": "string"
                  },
                  "source_type": {
                    "type": "string"
                  },
                  "target_type": {
                    "type": "string"
                  },
                  "file": {
                    "type": "string"
                  },
                  "line": {
                    "type": "integer"
                  },
                  "depth": {
                    "type": "integer"
                  }
                },
                "additionalProperties": true
              }
            },
            "max_depth": {
              "type": "integer"
            }
          }
        },
        {
          "type": "null"
        }
      ]
    },
    "diagnostics": {
      "type": "array",
      "items": {
        "type": "object",
        "required": [
          "severity",
          "file",
          "line",
          "col",
          "message"
        ],
        "properties": {
          "severity": {
            "type": "string",
            "enum": [
              "error",
              "warning",
              "note",
              "info"
            ]
          },
          "file": {
            "type": "string"
          },
          "line": {
            "type": "integer",
            "minimum": 0
          },
          "col": {
            "type": "integer",
            "minimum": 0
          },
          "message": {
            "type": "string"
          }
        },
        "additionalProperties": false
      }
    },
    "errors": {
      "type": "array",
      "items": {
        "type": "object",
        "required": [
          "code",
          "message"
        ],
        "properties": {
          "code": {
            "type": "string",
            "enum": [
              "INPUT_NOT_FOUND",
              "BAD_FILELIST",
              "COMPILE_FAILED",
              "SCOPE_NOT_FOUND",
              "SIGNAL_NOT_FOUND",
              "BAD_CONFIG",
              "NO_TOP",
              "INTERNAL_ERROR"
            ]
          },
          "message": {
            "type": "string"
          },
          "details": {
            "type": "object",
            "description": "Machine-readable recovery hints. For SCOPE_NOT_FOUND: valid_prefix, failing_component, close_matches, children. For SIGNAL_NOT_FOUND: close_matches, available."
          }
        },
        "additionalProperties": false
      }
    },
    "summary": {
      "oneOf": [
        {
          "type": "object",
          "required": [
            "mode",
            "results"
          ],
          "properties": {
            "mode": {
              "type": "string"
            },
            "results": {
              "type": "integer"
            },
            "nodes": {
              "type": "integer"
            },
            "edges": {
              "type": "integer"
            },
            "max_depth": {
              "type": "integer"
            }
          }
        },
        {
          "type": "null"
        }
      ]
    }
  },
  "additionalProperties": false
}
